{
  "version": "v1.0",
  "generated_at": "2026-05-17T18:27:32Z",
  "global": {
    "default_allowed_ops": [
      "SELECT"
    ],
    "default_denied_ops": [
      "INSERT",
      "UPDATE",
      "DELETE",
      "TRUNCATE",
      "DROP",
      "ALTER",
      "GRANT",
      "REVOKE",
      "COPY"
    ]
  },
  "tables": {
    "acc_number": {
      "aliases": [],
      "business_description": "ОСВ: Номер счета (TODO: уточнить бизнес-владельцем).",
      "cardinality_hint": "medium",
      "pii_tags": {},
      "allowed_ops": [
        "SELECT"
      ],
      "denied_ops": [],
      "approved_join_keys": [
        {
          "to": "acc_number",
          "on": "parent_acc",
          "to_column": "id"
        }
      ]
    },
    "afhd_ac_trans_link": {
      "aliases": [],
      "business_description": "АФХД. Промежуточный тип операции карточки счета  (декомпозиция) (TODO: уточнить бизнес-владельцем).",
      "cardinality_hint": "large",
      "pii_tags": {
        "debit_credit_id": "credit_data"
      },
      "allowed_ops": [
        "SELECT"
      ],
      "denied_ops": [],
      "approved_join_keys": [
        {
          "to": "sys_object",
          "on": "obj_owner_id",
          "to_column": "id"
        },
        {
          "to": "acc_number",
          "on": "account_num_id",
          "to_column": "id"
        },
        {
          "to": "sys_object",
          "on": "consolidation_obj_id",
          "to_column": "id"
        },
        {
          "to": "count_turnover",
          "on": "cnt_turnover_id",
          "to_column": "id"
        },
        {
          "to": "afhd_ac_trans_link",
          "on": "copy_source_ac_tr_l_id",
          "to_column": "id"
        }
      ]
    },
    "sys_obj_type": {
      "aliases": [],
      "business_description": "Тип объекта в Системе (TODO: уточнить бизнес-владельцем).",
      "cardinality_hint": "large",
      "pii_tags": {},
      "allowed_ops": [
        "SELECT"
      ],
      "denied_ops": [],
      "approved_join_keys": [
        {
          "to": "sys_obj_type",
          "on": "parent_id",
          "to_column": "id"
        }
      ]
    },
    "sys_object": {
      "aliases": [],
      "business_description": "Объект, SysObjectType{id=2, name='Объект', ident='SYS_OBJECT'} (TODO: уточнить бизнес-владельцем).",
      "cardinality_hint": "medium",
      "pii_tags": {},
      "allowed_ops": [
        "SELECT"
      ],
      "denied_ops": [],
      "approved_join_keys": []
    },
    "application_obj": {
      "aliases": [
        "базовые заявки",
        "заявка",
        "объект заявки",
        "application objects"
      ],
      "business_description": "Базовая сущность заявки, связывает состояние, бизнес-сегмент, продукт и ответственного менеджера.",
      "cardinality_hint": "large",
      "pii_tags": {},
      "allowed_ops": [
        "SELECT"
      ],
      "denied_ops": [],
      "approved_join_keys": [
        {
          "to": "sys_state",
          "on": "afp_state_id",
          "to_column": "id"
        },
        {
          "to": "scp_dict_tech_ctredit",
          "on": "scp_tech_ctredit",
          "to_column": "id"
        },
        {
          "to": "business_segment",
          "on": "scp_business_segment",
          "to_column": "id"
        },
        {
          "to": "sys_object",
          "on": "initiator_id",
          "to_column": "id"
        },
        {
          "to": "sys_employee",
          "on": "emp_id",
          "to_column": "id"
        }
      ]
    },
    "business_segment": {
      "aliases": [
        "сегменты бизнеса",
        "клиентские сегменты",
        "business segments"
      ],
      "business_description": "Справочник сегментов бизнеса клиента для группировки компаний и заявок.",
      "cardinality_hint": "small",
      "pii_tags": {},
      "allowed_ops": [
        "SELECT"
      ],
      "denied_ops": [],
      "approved_join_keys": []
    },
    "cb_interest_rate": {
      "aliases": [],
      "business_description": "Процентная ставка ЦБ (TODO: уточнить бизнес-владельцем).",
      "cardinality_hint": "small",
      "pii_tags": {},
      "allowed_ops": [
        "SELECT"
      ],
      "denied_ops": [],
      "approved_join_keys": []
    },
    "corp_tech_application": {
      "aliases": [
        "кт заявки",
        "корпоративные заявки",
        "corporate applications"
      ],
      "business_description": "Корпоративно-технологические заявки с участниками, состояниями, регионами и ответственными сотрудниками.",
      "cardinality_hint": "large",
      "pii_tags": {
        "credit_logic_id": "credit_logic",
        "cred_depart_opinion_txt": "credit_opinion"
      },
      "allowed_ops": [
        "SELECT"
      ],
      "denied_ops": [],
      "approved_join_keys": [
        {
          "to": "sys_employee",
          "on": "collat_initiator_id",
          "to_column": "id"
        },
        {
          "to": "sys_state",
          "on": "auto_check_status",
          "to_column": "id"
        },
        {
          "to": "dict_div_presence",
          "on": "deleg_region_id",
          "to_column": "id"
        },
        {
          "to": "scp_techcred",
          "on": "credit_logic_id",
          "to_column": "id"
        },
        {
          "to": "sys_employee",
          "on": "iniciator_emp_id",
          "to_column": "id"
        },
        {
          "to": "offices_psb",
          "on": "exp_fa_office_id",
          "to_column": "id"
        },
        {
          "to": "fs_file",
          "on": "interm_file_storage",
          "to_column": "id"
        },
        {
          "to": "sys_employee",
          "on": "scp_arm_manager_id",
          "to_column": "id"
        },
        {
          "to": "sys_company",
          "on": "initiator_id",
          "to_column": "id"
        },
        {
          "to": "scp_dict_tech_ctredit",
          "on": "scp_tech_ctredit",
          "to_column": "id"
        },
        {
          "to": "sys_employee",
          "on": "emp_id",
          "to_column": "id"
        },
        {
          "to": "sys_state",
          "on": "afp_state_id",
          "to_column": "id"
        },
        {
          "to": "sys_employee",
          "on": "resp_cond_coord",
          "to_column": "id"
        },
        {
          "to": "business_segment",
          "on": "scp_business_segment",
          "to_column": "id"
        },
        {
          "to": "sys_employee",
          "on": "scp_cheif_cm_id",
          "to_column": "id"
        },
        {
          "to": "offices_psb",
          "on": "ca_rout_office_id",
          "to_column": "id"
        }
      ]
    },
    "count_turnover": {
      "aliases": [],
      "business_description": "Субконто счет (примитив) (TODO: уточнить бизнес-владельцем).",
      "cardinality_hint": "large",
      "pii_tags": {
        "turnover_credit": "credit_data",
        "output_balance_credit": "credit_data",
        "input_balace_credit": "credit_data"
      },
      "allowed_ops": [
        "SELECT"
      ],
      "denied_ops": [],
      "approved_join_keys": [
        {
          "to": "tbs_type",
          "on": "correct_type",
          "to_column": "id"
        },
        {
          "to": "sys_company",
          "on": "link_cnt_owner",
          "to_column": "id"
        },
        {
          "to": "sys_object",
          "on": "link_partic_gr",
          "to_column": "id"
        },
        {
          "to": "sys_object",
          "on": "link_cred_doc_tur",
          "to_column": "id"
        },
        {
          "to": "acc_number",
          "on": "account_num_id",
          "to_column": "id"
        },
        {
          "to": "sys_object",
          "on": "link_load_val_id",
          "to_column": "id"
        },
        {
          "to": "count_turnover",
          "on": "parent_link_count",
          "to_column": "id"
        }
      ]
    },
    "credit_contract": {
      "aliases": [
        "кредитные договоры",
        "договоры кредита",
        "кредиты",
        "credit contracts",
        "loans"
      ],
      "business_description": "Кредитные договоры клиентов: номер договора, суммы, сроки, продукт, клиент и ответственный сотрудник.",
      "cardinality_hint": "large",
      "pii_tags": {
        "credit_contract_number": "contract_id",
        "credit_amount": "financial_amount",
        "credit_start_date": "date",
        "credit_end_date": "date",
        "credit_product": "financial_product",
        "uid_credit": "contract_id"
      },
      "allowed_ops": [
        "SELECT"
      ],
      "denied_ops": [],
      "approved_join_keys": [
        {
          "to": "sys_state",
          "on": "afp_state_id",
          "to_column": "id"
        },
        {
          "to": "sys_company",
          "on": "link_customer_id",
          "to_column": "id"
        },
        {
          "to": "sys_employee",
          "on": "sys_employee_id",
          "to_column": "id"
        }
      ]
    },
    "dict_div_presence": {
      "aliases": [],
      "business_description": "Справочник: регионы присутствия подразделений Банка (TODO: уточнить бизнес-владельцем).",
      "cardinality_hint": "small",
      "pii_tags": {},
      "allowed_ops": [
        "SELECT"
      ],
      "denied_ops": [],
      "approved_join_keys": []
    },
    "dict_product": {
      "aliases": [
        "продукты",
        "кредитные продукты",
        "справочник продуктов",
        "products"
      ],
      "business_description": "Справочник банковских продуктов и параметров лимитов, сроков и ставок.",
      "cardinality_hint": "medium",
      "pii_tags": {
        "term_limit_credit": "credit_terms",
        "max_sum_credit": "financial_amount",
        "min_sum_credit": "financial_amount",
        "credit_interest_rate": "financial_rate"
      },
      "allowed_ops": [
        "SELECT"
      ],
      "denied_ops": [],
      "approved_join_keys": [
        {
          "to": "business_segment",